[
  {
    "symbol": "CHIP",
    "narrative_score": 8,
    "sentiment_score": 2,
    "attention_score": 2,
    "liquidity_score": null,
    "volatility_score": null,
    "execution_score": 4.33,
    "risk_level": "medium",
    "status": "watch",
    "reason": "趋势走出来了 | 新币 / 热门赛道叙事",
    "invalid_condition": null,
    "updated_at": "2026-04-24T03:27:25Z"
  },
  {
    "symbol": "SPK",
    "narrative_score": 8,
    "sentiment_score": 2,
    "attention_score": 2,
    "liquidity_score": null,
    "volatility_score": null,
    "execution_score": 4.33,
    "risk_level": "medium",
    "status": "watch",
    "reason": "有点猛 / 资金外溢逻辑 | Spark / AAVE 资金迁移叙事",
    "invalid_condition": null,
    "updated_at": "2026-04-24T03:27:25Z"
  },
  {
    "symbol": "BTC",
    "narrative_score": 8,
    "sentiment_score": 2,
    "attention_score": 2,
    "liquidity_score": null,
    "volatility_score": null,
    "execution_score": 4.33,
    "risk_level": "medium",
    "status": "watch",
    "reason": "今天btc有点硬 | X/访谈中强调 BTC 偏强",
    "invalid_condition": null,
    "updated_at": "2026-04-24T03:27:25Z"
  },
  {
    "symbol": "KAT",
    "narrative_score": 4,
    "sentiment_score": 1,
    "attention_score": 1,
    "liquidity_score": 4,
    "volatility_score": 10,
    "execution_score": 3.0,
    "risk_level": "high",
    "status": "watch",
    "reason": "top_gainer_24h",
    "invalid_condition": null,
    "updated_at": "2026-04-24T03:27:25Z"
  },
  {
    "symbol": "MOVR",
    "narrative_score": 4,
    "sentiment_score": 1,
    "attention_score": 1,
    "liquidity_score": 4,
    "volatility_score": 10,
    "execution_score": 3.0,
    "risk_level": "high",
    "status": "watch",
    "reason": "top_gainer_24h",
    "invalid_condition": null,
    "updated_at": "2026-04-24T03:27:25Z"
  },
  {
    "symbol": "STO",
    "narrative_score": 4,
    "sentiment_score": 1,
    "attention_score": 1,
    "liquidity_score": 4,
    "volatility_score": 9.81,
    "execution_score": 3.0,
    "risk_level": "high",
    "status": "watch",
    "reason": "top_gainer_24h",
    "invalid_condition": null,
    "updated_at": "2026-04-24T03:27:25Z"
  },
  {
    "symbol": "LUNC",
    "narrative_score": 4,
    "sentiment_score": 1,
    "attention_score": 1,
    "liquidity_score": 4,
    "volatility_score": 7.63,
    "execution_score": 3.0,
    "risk_level": "high",
    "status": "watch",
    "reason": "top_gainer_24h",
    "invalid_condition": null,
    "updated_at": "2026-04-24T03:27:25Z"
  },
  {
    "symbol": "RED",
    "narrative_score": 4,
    "sentiment_score": 1,
    "attention_score": 1,
    "liquidity_score": 4,
    "volatility_score": 5.76,
    "execution_score": 3.0,
    "risk_level": "medium",
    "status": "watch",
    "reason": "top_gainer_24h",
    "invalid_condition": null,
    "updated_at": "2026-04-24T03:27:25Z"
  },
  {
    "symbol": "UTK",
    "narrative_score": 4,
    "sentiment_score": 1,
    "attention_score": 1,
    "liquidity_score": 4,
    "volatility_score": 5.64,
    "execution_score": 3.0,
    "risk_level": "medium",
    "status": "watch",
    "reason": "top_gainer_24h",
    "invalid_condition": null,
    "updated_at": "2026-04-24T03:27:25Z"
  },
  {
    "symbol": "GLMR",
    "narrative_score": 4,
    "sentiment_score": 1,
    "attention_score": 1,
    "liquidity_score": 3,
    "volatility_score": 10,
    "execution_score": 2.67,
    "risk_level": "high",
    "status": "watch",
    "reason": "top_gainer_24h",
    "invalid_condition": null,
    "updated_at": "2026-04-24T03:27:25Z"
  },
  {
    "symbol": "ZBT",
    "narrative_score": 4,
    "sentiment_score": 1,
    "attention_score": 1,
    "liquidity_score": 3,
    "volatility_score": 6.26,
    "execution_score": 2.67,
    "risk_level": "high",
    "status": "watch",
    "reason": "top_gainer_24h",
    "invalid_condition": null,
    "updated_at": "2026-04-24T03:27:25Z"
  },
  {
    "symbol": "SENT",
    "narrative_score": 4,
    "sentiment_score": 1,
    "attention_score": 1,
    "liquidity_score": 3,
    "volatility_score": 5.02,
    "execution_score": 2.67,
    "risk_level": "medium",
    "status": "watch",
    "reason": "top_gainer_24h",
    "invalid_condition": null,
    "updated_at": "2026-04-24T03:27:25Z"
  },
  {
    "symbol": "ESP",
    "narrative_score": 4,
    "sentiment_score": 1,
    "attention_score": 1,
    "liquidity_score": 3,
    "volatility_score": 4.65,
    "execution_score": 2.67,
    "risk_level": "medium",
    "status": "watch",
    "reason": "top_gainer_24h",
    "invalid_condition": null,
    "updated_at": "2026-04-24T03:27:25Z"
  },
  {
    "symbol": "LUMIA",
    "narrative_score": 4,
    "sentiment_score": 1,
    "attention_score": 1,
    "liquidity_score": 3,
    "volatility_score": 4.39,
    "execution_score": 2.67,
    "risk_level": "medium",
    "status": "watch",
    "reason": "top_gainer_24h",
    "invalid_condition": null,
    "updated_at": "2026-04-24T03:27:25Z"
  },
  {
    "symbol": "SOLV",
    "narrative_score": 4,
    "sentiment_score": 1,
    "attention_score": 1,
    "liquidity_score": 3,
    "volatility_score": 3.95,
    "execution_score": 2.67,
    "risk_level": "medium",
    "status": "watch",
    "reason": "top_gainer_24h",
    "invalid_condition": null,
    "updated_at": "2026-04-24T03:27:25Z"
  },
  {
    "symbol": "KAITO",
    "narrative_score": 4,
    "sentiment_score": 1,
    "attention_score": 1,
    "liquidity_score": 3,
    "volatility_score": 3.93,
    "execution_score": 2.67,
    "risk_level": "medium",
    "status": "watch",
    "reason": "top_gainer_24h",
    "invalid_condition": null,
    "updated_at": "2026-04-24T03:27:25Z"
  },
  {
    "symbol": "AAVE",
    "narrative_score": 4,
    "sentiment_score": 1,
    "attention_score": 1,
    "liquidity_score": null,
    "volatility_score": null,
    "execution_score": 2.67,
    "risk_level": "medium",
    "status": "watch",
    "reason": "行业自救，可能会有大反弹",
    "invalid_condition": null,
    "updated_at": "2026-04-24T03:27:25Z"
  },
  {
    "symbol": "ZEC",
    "narrative_score": 4,
    "sentiment_score": 1,
    "attention_score": 1,
    "liquidity_score": null,
    "volatility_score": null,
    "execution_score": 2.67,
    "risk_level": "medium",
    "status": "watch",
    "reason": "今天走的比较强",
    "invalid_condition": null,
    "updated_at": "2026-04-24T03:27:25Z"
  },
  {
    "symbol": "KAS",
    "narrative_score": 4,
    "sentiment_score": 1,
    "attention_score": 1,
    "liquidity_score": null,
    "volatility_score": null,
    "execution_score": 2.67,
    "risk_level": "medium",
    "status": "watch",
    "reason": "还在找合适的点位上车",
    "invalid_condition": null,
    "updated_at": "2026-04-24T03:27:25Z"
  },
  {
    "symbol": "TRUMP",
    "narrative_score": 4,
    "sentiment_score": 1,
    "attention_score": 1,
    "liquidity_score": null,
    "volatility_score": null,
    "execution_score": 2.67,
    "risk_level": "medium",
    "status": "watch",
    "reason": "晚宴事件，市场一致看空时反向看多",
    "invalid_condition": null,
    "updated_at": "2026-04-24T03:27:25Z"
  },
  {
    "symbol": "DOGE",
    "narrative_score": 4,
    "sentiment_score": 1,
    "attention_score": 1,
    "liquidity_score": null,
    "volatility_score": null,
    "execution_score": 2.67,
    "risk_level": "medium",
    "status": "watch",
    "reason": "老马相关热门",
    "invalid_condition": null,
    "updated_at": "2026-04-24T03:27:25Z"
  },
  {
    "symbol": "GENIUS",
    "narrative_score": 4,
    "sentiment_score": 1,
    "attention_score": 1,
    "liquidity_score": null,
    "volatility_score": null,
    "execution_score": 2.67,
    "risk_level": "medium",
    "status": "watch",
    "reason": "机构标 / 新币观察",
    "invalid_condition": null,
    "updated_at": "2026-04-24T03:27:25Z"
  },
  {
    "symbol": "CREAM",
    "narrative_score": 4,
    "sentiment_score": 1,
    "attention_score": 1,
    "liquidity_score": 2,
    "volatility_score": 10,
    "execution_score": 2.33,
    "risk_level": "high",
    "status": "watch",
    "reason": "top_gainer_24h",
    "invalid_condition": null,
    "updated_at": "2026-04-24T03:27:25Z"
  },
  {
    "symbol": "PNT",
    "narrative_score": 4,
    "sentiment_score": 1,
    "attention_score": 1,
    "liquidity_score": 2,
    "volatility_score": 10,
    "execution_score": 2.33,
    "risk_level": "high",
    "status": "watch",
    "reason": "top_gainer_24h",
    "invalid_condition": null,
    "updated_at": "2026-04-24T03:27:25Z"
  },
  {
    "symbol": "KDA",
    "narrative_score": 4,
    "sentiment_score": 1,
    "attention_score": 1,
    "liquidity_score": 2,
    "volatility_score": 5.88,
    "execution_score": 2.33,
    "risk_level": "medium",
    "status": "watch",
    "reason": "top_gainer_24h",
    "invalid_condition": null,
    "updated_at": "2026-04-24T03:27:25Z"
  },
  {
    "symbol": "CLV",
    "narrative_score": 4,
    "sentiment_score": 1,
    "attention_score": 1,
    "liquidity_score": 2,
    "volatility_score": 4.66,
    "execution_score": 2.33,
    "risk_level": "medium",
    "status": "watch",
    "reason": "top_gainer_24h",
    "invalid_condition": null,
    "updated_at": "2026-04-24T03:27:25Z"
  },
  {
    "symbol": "MDX",
    "narrative_score": 4,
    "sentiment_score": 1,
    "attention_score": 1,
    "liquidity_score": 2,
    "volatility_score": 4.51,
    "execution_score": 2.33,
    "risk_level": "medium",
    "status": "watch",
    "reason": "top_gainer_24h",
    "invalid_condition": null,
    "updated_at": "2026-04-24T03:27:25Z"
  },
  {
    "symbol": "WAVES",
    "narrative_score": 4,
    "sentiment_score": 1,
    "attention_score": 1,
    "liquidity_score": 2,
    "volatility_score": 3.99,
    "execution_score": 2.33,
    "risk_level": "medium",
    "status": "watch",
    "reason": "top_gainer_24h",
    "invalid_condition": null,
    "updated_at": "2026-04-24T03:27:25Z"
  },
  {
    "symbol": "CGPT",
    "narrative_score": 4,
    "sentiment_score": 1,
    "attention_score": 1,
    "liquidity_score": 2,
    "volatility_score": 3.83,
    "execution_score": 2.33,
    "risk_level": "medium",